"created","text"
"02/04/2017","Machung Olympiad 2017, Kompetisi Olahraga Terbesar Universitas Machung Hadir Kembali! - https://t.co/gdztxHRkM1 https://t.co/sbeSgzQaWL"
"29/03/2017","Jaringan Internet Telkom di kampus MaChung putus dari pagi :( #telkom #Internet"
"29/03/2017","Partisipasi Tim Bola voli putri smk nasional malang di machung  #smknasionalmalang https://t.co/GsVuyRkVNJ"
"27/03/2017","Rumah Disewakan Di Perum Villa Puncak Tidar, Cluster Favorit Dekat Universitas Machung - ERA Ventura #infomalangraya https://t.co/lMSY5Q2xaL"
"25/03/2017","Cmn nngguin mas comi dkk ku (at Universitas Machung)  https://t.co/hsnijZkMWF"
"24/03/2017","@HananiShofi sabtu, besok. Malem. Di machung. Oke? Isooo wes"
"02/04/2017","@BlackBarmitzvar Akili imeoshwa na vitu za wazungu na bado wajiita mtu?Ata akichomwa si ati wezi wameisha bado kesh https://t.co/62DlSJlBtj"
"02/04/2017","Ini Hasil Lengkap Cabor Voli Hari Kedua Machung Olympiad 2017 - https://t.co/Ntn9kMjfQJ https://t.co/56evhIYPzw"
